{
  "id": "gatsby-js",
  "name": "Gatsby",
  "category": "Development tools",
  "description": "Gatsby contains a telemetry feature that collects anonymous usage information that is used to help improve Gatsby for all users. The Gatsby user base is growing very rapidly. Itâ€™s important that our small team and the greater community will better understand the usage patterns, so we can best decide how to design future features and prioritize current work.",
  "links": {
    "main": "https://www.gatsbyjs.org",
    "telemetry": "https://www.gatsbyjs.org/docs/telemetry/",
    "privacy": "https://www.gatsbyjs.com/privacy-policy/"
  },
  "telemetry": [
    {
      "id": "usage-data",
      "name": "Usage data",
      "target": {
        "env": {
          "path": {
            "default": "GATSBY_TELEMETRY_DISABLED"
          },
          "value": {
            "opt_out": "1",
            "opt_in": "0"
          }
        },
        "exec": {
          "path": {
            "default": "gatsby"
          },
          "value": {
            "opt_out": "telemetry --disable",
            "opt_in": "telemetry --enable"
          }
        }
      }
    }
  ]
}