{
  "id": "automated-lab",
  "name": "AutomatedLab",
  "category": "Development tools",
  "description": "AutomatedLab will start to collect telemetry starting with version 5.0. This is an opt-out collection and you will be asked once to specify whether or not you want to send us telemetry data.",
  "links": {
    "main": "https://github.com/AutomatedLab/AutomatedLab",
    "telemetry": "https://github.com/AutomatedLab/AutomatedLab/wiki/Lab-Telemetry"
  },
  "telemetry": [
    {
      "id": "usage-data",
      "name": "Usage data",
      "target": {
        "env": {
          "path": {
            "default": "AUTOMATEDLAB_TELEMETRY_OPTOUT"
          },
          "value": {
            "opt_out": "1",
            "opt_in": "0"
          }
        },
        "exec": {
          "path": {
            "default": "pwsh",
            "windows": "powershell"
          },
          "value": {
            "opt_out": "-NoLogo -NoProfile -NonInteractive -ExecutionPolicy Bypass -Command \"Import-Module AutomatedLab -ErrorAction Stop ; Disable-LabTelemetry -ErrorAction Stop\"",
            "opt_in": "-NoLogo -NoProfile -NonInteractive -ExecutionPolicy Bypass -Command \"Import-Module AutomatedLab -ErrorAction Stop ; Enable-LabTelemetry -ErrorAction Stop\""
          }
        }
      }
    }
  ]
}