{
  "id": "cordova-cli",
  "name": "Apache Cordova CLI",
  "category": "Development tools",
  "description": "We use the gathered information to help us make our tool more useful and to better understand how it is used. We do not track or collect personally identifiable information or associate gathered data with any personally identifying information from other sources.",
  "links": {
    "main": "https://cordova.apache.org",
    "telemetry": "https://cordova.apache.org/docs/en/latest/reference/cordova-cli/#global-command-list",
    "privacy": "https://cordova.apache.org/privacy/"
  },
  "telemetry": [
    {
      "id": "usage-data",
      "name": "Usage data",
      "target": {
        "env": {
          "path": {
            "default": "CI"
          },
          "value": {
            "opt_out": "ANY_VALUE",
            "opt_in": null
          }
        },
        "exec": {
          "path": {
            "default": "cordova"
          },
          "value": {
            "opt_out": "telemetry off",
            "opt_in": "telemetry off"
          }
        }
      }
    }
  ]
}